{"correctionId": "6a30cd9c-67fe-439c-af63-99e2928fc347", "agent": {"id": "model", "publicKey": "yFDt9fpzgrgG_6U10APnnVuR8IvZ9n-I_apWqvkuYVU"}, "principal": {"id": "unknown", "type": "organization"}, "action": {"type": "test"}, "reason": "", "trigger": "supersede", "fix": {"type": "noop"}, "timestamp": "2026-09-10T03:13:04.255067+00:00", "metadata": {}, "signature": {"alg": "Ed25519", "kid": "yFDt9fpzgrgG_6U10APnnVuR8IvZ9n-I_apWqvkuYVU", "publicKey": "yFDt9fpzgrgG_6U10APnnVuR8IvZ9n-I_apWqvkuYVU", "canonicalization": "RFC8785", "sig": "8EbtZGIy-eBMgBNh98OloWJ3T647FLOq4Bcddq5iNaMjtCeVIDrUug2RuK9e9ApKrpVgNXiHNTusbCWl8QyDCw"}}