{"correctionId": "a33ddd2b-d9d7-47d1-a02a-135eb6fb3e33", "agent": {"id": "model", "publicKey": "0BqfnaOjuXh3wyq_fIUj5_4-bZ1gJkFbtsGMk0IrEF4"}, "principal": {"id": "unknown", "type": "organization"}, "action": {"type": "test"}, "reason": "", "trigger": "supersede", "fix": {"type": "noop"}, "timestamp": "2026-09-10T03:13:04.251527+00:00", "metadata": {}, "signature": {"alg": "Ed25519", "kid": "0BqfnaOjuXh3wyq_fIUj5_4-bZ1gJkFbtsGMk0IrEF4", "publicKey": "0BqfnaOjuXh3wyq_fIUj5_4-bZ1gJkFbtsGMk0IrEF4", "canonicalization": "RFC8785", "sig": "2O8t2LvM8urbKr2qOBzWwR55NWW-tBTFZHxI3Rm8vztabd8p0RrnyB6BDp4NhV9VwRcoZiAXtMmWCUUdNt8vAg"}}